{
  "schema": "HMS_CORPUS_MANIFEST_V1",
  "corpus_id": "LP-75-IMAGES",
  "version": "1.0.0",
  "files": [
    {
      "path": "00.jpg",
      "sha256": "184e6f9de8695d99435c2bef4fd7e304a8a0f704dbe04439fa8bf13c4da395a7",
      "bytes": 168876,
      "role": "CANONICAL_PAGE_IMAGE"
    },
    {
      "path": "01.jpg",
      "sha256": "71f4bd03c692ede630091272597d2b18702184ed32fdd1977ef0ba7306632b46",
      "bytes": 1476614,
      "role": "CANONICAL_PAGE_IMAGE"
    },
    {
      "path": "02.jpg",
      "sha256": "0297572bbc2d234f84df634c6f0474011ff5df66c2ce987c3bb7aa0c635799b4",
      "bytes": 175159,
      "role": "CANONICAL_PAGE_IMAGE"
    },
    {
      "path": "03.jpg",
      "sha256": "b8b142f9b7854ec4f240e076cad03a98a2e3e9cf7c20f1da4fcde1ed25e3be3f",
      "bytes": 892759,
      "role": "CANONICAL_PAGE_IMAGE"
    },
    {
      "path": "04.jpg",
      "sha256": "745c6a46f67de1e5a2a9ac76175c323af82c2432e3b7483a8dc6244f8de9478f",
      "bytes": 1223337,
      "role": "CANONICAL_PAGE_IMAGE"
    },
    {
      "path": "05.jpg",
      "sha256": "2db94921ae5216d8a589890495fa5432446cd3227c45fbeb4934cbb0525112f7",
      "bytes": 673066,
      "role": "CANONICAL_PAGE_IMAGE"
    },
    {
      "path": "06.jpg",
      "sha256": "913e26462e51942f49ca3ce2e94ef56c5fb65110814442dccc02b0d88af2c5ca",
      "bytes": 823807,
      "role": "CANONICAL_PAGE_IMAGE"
    },
    {
      "path": "07.jpg",
      "sha256": "b50c1536ea1f30847e7875835991d52951bafb599fb1ab04eb78c5c6e6c2b468",
      "bytes": 823514,
      "role": "CANONICAL_PAGE_IMAGE"
    },
    {
      "path": "08.jpg",
      "sha256": "f0edba1084df9983353c11544bbf711f94ed7649edbf94b426c9b78549b64557",
      "bytes": 638805,
      "role": "CANONICAL_PAGE_IMAGE"
    },
    {
      "path": "09.jpg",
      "sha256": "975cda73bbf829b2775f25beb609d34fa429728b2f2a4ce863c129b10b005089",
      "bytes": 724577,
      "role": "CANONICAL_PAGE_IMAGE"
    },
    {
      "path": "10.jpg",
      "sha256": "12ebfe421c129f2ef78d527c1630e358963da8d8dfdf9620eb977980d7967376",
      "bytes": 4240957,
      "role": "CANONICAL_PAGE_IMAGE"
    },
    {
      "path": "11.jpg",
      "sha256": "7bd11a2c9f5b512e33c9db170756e3b34cc1e29eb405373eb94957383a61be7d",
      "bytes": 712733,
      "role": "CANONICAL_PAGE_IMAGE"
    },
    {
      "path": "12.jpg",
      "sha256": "a5b58076e169f3f59c8a394dbef37da18226c9c4fff703df3be8dc95cf16291c",
      "bytes": 703428,
      "role": "CANONICAL_PAGE_IMAGE"
    },
    {
      "path": "13.jpg",
      "sha256": "bef0fc4867c2363c835eb4f08029a1eba35c925e2f72659d7353cf8a91089e56",
      "bytes": 2070134,
      "role": "CANONICAL_PAGE_IMAGE"
    },
    {
      "path": "14.jpg",
      "sha256": "de2bebe1d06421d94f3dd2b2b5f838ee4cdb5f51b07b14e880e0108f7b79c14e",
      "bytes": 625668,
      "role": "CANONICAL_PAGE_IMAGE"
    },
    {
      "path": "15.jpg",
      "sha256": "f163903bec1236f1c89c96343d0bd1dee610b697c3ba82514651f04c5fbee4b9",
      "bytes": 426945,
      "role": "CANONICAL_PAGE_IMAGE"
    },
    {
      "path": "16.jpg",
      "sha256": "984668c680c6089b91587ef6d9eb2a1df1d2b7ee8ab3837655d3933f2adcbfbe",
      "bytes": 485456,
      "role": "CANONICAL_PAGE_IMAGE"
    },
    {
      "path": "17.jpg",
      "sha256": "197e1e153958b9a2736b09c10eea7d8bb00e0632fd22a8d9606840becc79942e",
      "bytes": 695525,
      "role": "CANONICAL_PAGE_IMAGE"
    },
    {
      "path": "18.jpg",
      "sha256": "f804fae06a68315eb6206158a2b34f55fe157c7d663fa961639fbe8dfc52a39f",
      "bytes": 667228,
      "role": "CANONICAL_PAGE_IMAGE"
    },
    {
      "path": "19.jpg",
      "sha256": "74e955ebe248e6d7442e2d2cd3029951f258017987d5762f48e7897cf6611e34",
      "bytes": 595338,
      "role": "CANONICAL_PAGE_IMAGE"
    },
    {
      "path": "20.jpg",
      "sha256": "1453ef27ea607c6ea378d6472c908e77c2881caba33c72d1893caddee8dc1117",
      "bytes": 599916,
      "role": "CANONICAL_PAGE_IMAGE"
    },
    {
      "path": "21.jpg",
      "sha256": "72bea2bfcd4f1b8e2095f882811d0f294e329d4b1bfe68f8ed5ec726d0a1e9d6",
      "bytes": 676634,
      "role": "CANONICAL_PAGE_IMAGE"
    },
    {
      "path": "22.jpg",
      "sha256": "bcef0a3b80532b25a013052ec4394ab47ab69ce675b5b3db59cbad044e7adabd",
      "bytes": 667716,
      "role": "CANONICAL_PAGE_IMAGE"
    },
    {
      "path": "23.jpg",
      "sha256": "4c7dce370242c67a7b785828d75547c042717b221d9d565d7dd097834c7b25d7",
      "bytes": 556991,
      "role": "CANONICAL_PAGE_IMAGE"
    },
    {
      "path": "24.jpg",
      "sha256": "91a726a7dd59c6caa4d736b9ce72ceba0a2fa827d6b69a2d4057562b9303636c",
      "bytes": 580968,
      "role": "CANONICAL_PAGE_IMAGE"
    },
    {
      "path": "25.jpg",
      "sha256": "6b1026dfdfb447a5a76819883fe576254e8a47fdf1e97ecf1825166833bc6f00",
      "bytes": 612380,
      "role": "CANONICAL_PAGE_IMAGE"
    },
    {
      "path": "26.jpg",
      "sha256": "b8b7ee73d51de45833b36d864cb1c9067432cb4efadcf6c319eaef94d52c929d",
      "bytes": 639920,
      "role": "CANONICAL_PAGE_IMAGE"
    },
    {
      "path": "27.jpg",
      "sha256": "1716e282c1d5e8a9ff911c01621e9b195d4728c7fa55ac857176a473eaba3239",
      "bytes": 618194,
      "role": "CANONICAL_PAGE_IMAGE"
    },
    {
      "path": "28.jpg",
      "sha256": "26f0cb307a23dcb2adf03a70fb9c6da89746258a90fd9be5383b2757ab4aad30",
      "bytes": 609111,
      "role": "CANONICAL_PAGE_IMAGE"
    },
    {
      "path": "29.jpg",
      "sha256": "6961f3f8eedba5b802fee9b40ad91fa604cd4e4394f9ba72853141ad71b19b21",
      "bytes": 609412,
      "role": "CANONICAL_PAGE_IMAGE"
    },
    {
      "path": "30.jpg",
      "sha256": "3481daeed3ab2bea6effbe36eec22f74955bce87ca4b4ae8674be1d3f84ea08d",
      "bytes": 619368,
      "role": "CANONICAL_PAGE_IMAGE"
    },
    {
      "path": "31.jpg",
      "sha256": "861037ea304b4d3b347cce18d97f25146f6f318cb748e59e6140d9eeaef6abd4",
      "bytes": 436699,
      "role": "CANONICAL_PAGE_IMAGE"
    },
    {
      "path": "32.jpg",
      "sha256": "5543cfce96493b86eece3195b3f5ea6e779ff41551676600b0c2479fc18c0ec5",
      "bytes": 512272,
      "role": "CANONICAL_PAGE_IMAGE"
    },
    {
      "path": "33.jpg",
      "sha256": "39780578c48d318310c3bccb0bc30e96adcb5b2de6e4a965000c55465375861d",
      "bytes": 550563,
      "role": "CANONICAL_PAGE_IMAGE"
    },
    {
      "path": "34.jpg",
      "sha256": "f123b66eefa1b4409750c5ea3879bfe64728c6aa1e1398cb8fbd0fa8b1cf1f50",
      "bytes": 541530,
      "role": "CANONICAL_PAGE_IMAGE"
    },
    {
      "path": "35.jpg",
      "sha256": "90fa414c464e86435bdb22f051f9670e886e3dd1c0b6d8954be94b86188da94b",
      "bytes": 541718,
      "role": "CANONICAL_PAGE_IMAGE"
    },
    {
      "path": "36.jpg",
      "sha256": "b57ec6b12cb9a505eec6a77c64ddf63bf30a1bfb44dd5cdca35d900feed1b651",
      "bytes": 540260,
      "role": "CANONICAL_PAGE_IMAGE"
    },
    {
      "path": "37.jpg",
      "sha256": "1ceef52570621785a021febff39003538f810179e5767ef5279a59c0c05c9985",
      "bytes": 535883,
      "role": "CANONICAL_PAGE_IMAGE"
    },
    {
      "path": "38.jpg",
      "sha256": "c453ad16212b335a065069e9f755791b909225ed250b579eab205655e7a80c10",
      "bytes": 550964,
      "role": "CANONICAL_PAGE_IMAGE"
    },
    {
      "path": "39.jpg",
      "sha256": "e232eb4649f89125d0edeab7022cbe189185d46ccbf0823fd964b6e71e9bafe7",
      "bytes": 512143,
      "role": "CANONICAL_PAGE_IMAGE"
    },
    {
      "path": "40.jpg",
      "sha256": "d31a23cb3a2e50b505e1c468ffbb0106f5353f469bb5958b87ab929fc88decee",
      "bytes": 484095,
      "role": "CANONICAL_PAGE_IMAGE"
    },
    {
      "path": "41.jpg",
      "sha256": "62148ef272d17bcedf5df30f6cc9e52df127113c18c1cf57ea92c75feedfce80",
      "bytes": 654761,
      "role": "CANONICAL_PAGE_IMAGE"
    },
    {
      "path": "42.jpg",
      "sha256": "a7d6e597debff4f7c5b3516e1b02ca2e4fa5b37d972f567264ed2ec845013cff",
      "bytes": 643754,
      "role": "CANONICAL_PAGE_IMAGE"
    },
    {
      "path": "43.jpg",
      "sha256": "ed88f5fcdca3d1f846538caa8be979aa28cde969eb99c9464d60daa26c1f9af7",
      "bytes": 677224,
      "role": "CANONICAL_PAGE_IMAGE"
    },
    {
      "path": "44.jpg",
      "sha256": "c92c972f41dd038e136d8589aa7b113e268c36f2860c279cce712cd037cb3a8e",
      "bytes": 580041,
      "role": "CANONICAL_PAGE_IMAGE"
    },
    {
      "path": "45.jpg",
      "sha256": "318bb587f4dcab11b4db7ba3b8bb13b7913ca79bb409e1c987595503a22e0522",
      "bytes": 542267,
      "role": "CANONICAL_PAGE_IMAGE"
    },
    {
      "path": "46.jpg",
      "sha256": "6f769f266865ddb30b0cb34e82c664a87ba409f674dc52ad3af7c85be443fb5c",
      "bytes": 546105,
      "role": "CANONICAL_PAGE_IMAGE"
    },
    {
      "path": "47.jpg",
      "sha256": "701b66d1fe98f730dadc5d7d8e1bc3b9a8e20547c1ffb423011f436037dba8b0",
      "bytes": 539780,
      "role": "CANONICAL_PAGE_IMAGE"
    },
    {
      "path": "48.jpg",
      "sha256": "0cb60ca12b1bf5f9fc03026314018a0d5ee73f813ac86ca4197629c60f2cb80a",
      "bytes": 531046,
      "role": "CANONICAL_PAGE_IMAGE"
    },
    {
      "path": "49.jpg",
      "sha256": "c0f778187a8e9ddbfc667a65929ac567430a2e38278a2022377984ac084e5f72",
      "bytes": 362637,
      "role": "CANONICAL_PAGE_IMAGE"
    },
    {
      "path": "50.jpg",
      "sha256": "13ff4c8d8ab934032a001b8c1fda16433aa44a38dd7272b3ff0dd7ac8300c62d",
      "bytes": 525652,
      "role": "CANONICAL_PAGE_IMAGE"
    },
    {
      "path": "51.jpg",
      "sha256": "6f1b4c04b64ee54c689478bd3986bb6ab8a3b81f48780562094e9f248e4e87f8",
      "bytes": 555050,
      "role": "CANONICAL_PAGE_IMAGE"
    },
    {
      "path": "52.jpg",
      "sha256": "d713dd913d9b835ac61f298e8c0855f5093599e348edaedef964710db8664afa",
      "bytes": 574580,
      "role": "CANONICAL_PAGE_IMAGE"
    },
    {
      "path": "53.jpg",
      "sha256": "3b54a31a9e796e2c01b4e80d46e1092dee2e1142a7c61873e282078e2c776cb9",
      "bytes": 511099,
      "role": "CANONICAL_PAGE_IMAGE"
    },
    {
      "path": "54.jpg",
      "sha256": "cee96d7e71b7de4d4e57237faacefad791229c153202e8224e4bedda45fb8f43",